{
  "schema_version": 1,
  "program_role": "standalone",
  "governance_source": "sdd/parches/example/definicion.md",
  "base_branch": "main",
  "head_branch": "patch/example",
  "primary_integration": {
    "provider": "github",
    "id": "11",
    "url": "https://example.invalid/pull/11"
  },
  "promotion_refs": [],
  "included_patches": ["example"],
  "provider_snapshot": {
    "provider": "github",
    "state": "closed",
    "head_sha": "abc789",
    "checks": [],
    "observed_at": "2026-06-20T00:00:00Z"
  },
  "paw_readiness": "blocked",
  "delivery_disposition": "closed_unmerged",
  "merged_refs": []
}
